fieldType,Product Name,Brand,description,productImageUrl,Category,Sub Category,Prod Code,sku,ribbon,price,surcharge,visible,discountMode,discountValue,inventory,weight,Unit Value,Sale Price,Base Price,GST Rate,GST Amount,Filter 1,Filter 1 Type,Filter 1 Value,additionalInfoTitle1,Filter 2,Filter 2 Type,Filter 2 Value,Filter 3,Filter 3 Type,Filter 3 Value
Product,Century Ply Look Book Laminate Flake Oak 3676,Century Ply,"Century Ply Laminates are a premium laminate designed to elevate your interiors with its exquisite finish. This laminate boasts an impressive 0.8 mm thickness, making it incredibly durable and resistant to cracking. Its uniform thickness ensures a smooth and seamless surface, while its stain and steam resistance.",https://www.centuryply.com/centurylaminates/productImage/3676-SU-N.jpg,Wooden Material,Laminate,FLAKE OAK 3676,LMNTCMBFLOAK3676,,1910.13,,TRUE,PERCENT,15,InStock,,Sheet,1295,,,,Thickness,DROP_DOWN,1mm,,Finish,DROP_DOWN,Combinations,,DROP_DOWN,
Product,Century Ply Look Book Laminate Flocon Oak 3677,Century Ply,"Century Ply Laminates are a premium laminate designed to elevate your interiors with its exquisite finish. This laminate boasts an impressive 0.8 mm thickness, making it incredibly durable and resistant to cracking. Its uniform thickness ensures a smooth and seamless surface, while its stain and steam resistance.",https://www.centuryply.com/centurylaminates/productImage/3677-SU-N.jpg,Wooden Material,Laminate,FLOCON OAK 3677,LMNTCMBFLOAK3677,,1910.13,,TRUE,PERCENT,15,InStock,,Sheet,1295,,,,Thickness,DROP_DOWN,1mm,,Finish,DROP_DOWN,Combinations,,DROP_DOWN,
Product,Century Ply Look Book Laminate Ameris Oak 94671,Century Ply,"Century Ply Laminates are a premium laminate designed to elevate your interiors with its exquisite finish. This laminate boasts an impressive 0.8 mm thickness, making it incredibly durable and resistant to cracking. Its uniform thickness ensures a smooth and seamless surface, while its stain and steam resistance.",https://www.centuryply.com/centurylaminates/productImage/94671.jpg,Wooden Material,Laminate,AMERIS OAK 94671,LMNTCMBAMOAK94671,,1910.13,,TRUE,PERCENT,15,InStock,,Sheet,1295,,,,Thickness,DROP_DOWN,1mm,,Finish,DROP_DOWN,Combinations,,DROP_DOWN,
Product,Century Ply Look Book Laminate Saddle Oak 94672,Century Ply,"Century Ply Laminates are a premium laminate designed to elevate your interiors with its exquisite finish. This laminate boasts an impressive 0.8 mm thickness, making it incredibly durable and resistant to cracking. Its uniform thickness ensures a smooth and seamless surface, while its stain and steam resistance.",https://www.centuryply.com/centurylaminates/productImage/94672.jpg,Wooden Material,Laminate,SADDLE OAK 94672,LMNTCMBSAOAK94672,,1910.13,,TRUE,PERCENT,15,InStock,,Sheet,1295,,,,Thickness,DROP_DOWN,1mm,,Finish,DROP_DOWN,Combinations,,DROP_DOWN,
Product,Century Ply Look Book Laminate Oakwood Grey 3393,Century Ply,"Century Ply Laminates are a premium laminate designed to elevate your interiors with its exquisite finish. This laminate boasts an impressive 0.8 mm thickness, making it incredibly durable and resistant to cracking. Its uniform thickness ensures a smooth and seamless surface, while its stain and steam resistance.",https://www.centuryply.com/centurylaminates/productImage/3393.jpg,Wooden Material,Laminate,OAKWOOD GREY 3393,LMNTCMBOAGEY3393,,1910.13,,TRUE,PERCENT,15,InStock,,Sheet,1295,,,,Thickness,DROP_DOWN,1mm,,Finish,DROP_DOWN,Combinations,,DROP_DOWN,
Product,Century Ply Look Book Laminate Oakwood Cream 3394,Century Ply,"Century Ply Laminates are a premium laminate designed to elevate your interiors with its exquisite finish. This laminate boasts an impressive 0.8 mm thickness, making it incredibly durable and resistant to cracking. Its uniform thickness ensures a smooth and seamless surface, while its stain and steam resistance.",https://www.centuryply.com/centurylaminates/productImage/3394.jpg,Wooden Material,Laminate,OAKWOOD CREAM,LMNTCMBOACAM,,1910.13,,TRUE,PERCENT,15,InStock,,Sheet,1295,,,,Thickness,DROP_DOWN,1mm,,Finish,DROP_DOWN,Combinations,,DROP_DOWN,
Product,Century Ply Look Book Laminate Eugele Walnut 4502,Century Ply,"Century Ply Laminates are a premium laminate designed to elevate your interiors with its exquisite finish. This laminate boasts an impressive 0.8 mm thickness, making it incredibly durable and resistant to cracking. Its uniform thickness ensures a smooth and seamless surface, while its stain and steam resistance.",https://www.centuryply.com/centurylaminates/productImage/4502.jpg,Wooden Material,Laminate,EUGELE WALNUT 4502,LMNTCMBEUWUT4502,,1910.13,,TRUE,PERCENT,15,InStock,,Sheet,1295,,,,Thickness,DROP_DOWN,1mm,,Finish,DROP_DOWN,Combinations,,DROP_DOWN,
Product,Century Ply Look Book Laminate Degas Walnut 4503,Century Ply,"Century Ply Laminates are a premium laminate designed to elevate your interiors with its exquisite finish. This laminate boasts an impressive 0.8 mm thickness, making it incredibly durable and resistant to cracking. Its uniform thickness ensures a smooth and seamless surface, while its stain and steam resistance.",https://www.centuryply.com/centurylaminates/productImage/4503.jpg,Wooden Material,Laminate,DEGAS WALNUT 4503,LMNTCMBDEWUT4503,,1910.13,,TRUE,PERCENT,15,InStock,,Sheet,1295,,,,Thickness,DROP_DOWN,1mm,,Finish,DROP_DOWN,Combinations,,DROP_DOWN,
Product,Century Ply Look Book Laminate Gauguin Walnut 4501,Century Ply,"Century Ply Laminates are a premium laminate designed to elevate your interiors with its exquisite finish. This laminate boasts an impressive 0.8 mm thickness, making it incredibly durable and resistant to cracking. Its uniform thickness ensures a smooth and seamless surface, while its stain and steam resistance.",https://www.centuryply.com/centurylaminates/productImage/4501.jpg,Wooden Material,Laminate,GAUGUIN WALNUT 4501,LMNTCMBGAWUT4501,,1910.13,,TRUE,PERCENT,15,InStock,,Sheet,1295,,,,Thickness,DROP_DOWN,1mm,,Finish,DROP_DOWN,Combinations,,DROP_DOWN,
Product,Century Ply Look Book Laminate Cordia Zericote 689,Century Ply,"Century Ply Laminates are a premium laminate designed to elevate your interiors with its exquisite finish. This laminate boasts an impressive 0.8 mm thickness, making it incredibly durable and resistant to cracking. Its uniform thickness ensures a smooth and seamless surface, while its stain and steam resistance.",https://www.centuryply.com/centurylaminates/productImage/689.jpg,Wooden Material,Laminate,CORDIA ZERICOTE 689,LMNTCMBCOZTE689,,1910.13,,TRUE,PERCENT,15,InStock,,Sheet,1295,,,,Thickness,DROP_DOWN,1mm,,Finish,DROP_DOWN,Combinations,,DROP_DOWN,
Product,Century Ply Look Book Laminate Berger Walnut 93415,Century Ply,"Century Ply Laminates are a premium laminate designed to elevate your interiors with its exquisite finish. This laminate boasts an impressive 0.8 mm thickness, making it incredibly durable and resistant to cracking. Its uniform thickness ensures a smooth and seamless surface, while its stain and steam resistance.",https://www.centuryply.com/centurylaminates/productImage/93415.jpg,Wooden Material,Laminate,BERGER WALNUT 93415,LMNTCMBBEWUT93415,,1910.13,,TRUE,PERCENT,15,InStock,,Sheet,1295,,,,Thickness,DROP_DOWN,1mm,,Finish,DROP_DOWN,Combinations,,DROP_DOWN,
Product,Century Ply Look Book Laminate Strauss Walnut 93414,Century Ply,"Century Ply Laminates are a premium laminate designed to elevate your interiors with its exquisite finish. This laminate boasts an impressive 0.8 mm thickness, making it incredibly durable and resistant to cracking. Its uniform thickness ensures a smooth and seamless surface, while its stain and steam resistance.",https://www.centuryply.com/centurylaminates/productImage/93414.jpg,Wooden Material,Laminate,STRAUSS WALNUT 93414,LMNTCMBSTWUT93414,,1910.13,,TRUE,PERCENT,15,InStock,,Sheet,1295,,,,Thickness,DROP_DOWN,1mm,,Finish,DROP_DOWN,Combinations,,DROP_DOWN,
Product,Century Ply Look Book Laminate Cranville Elm 3755,Century Ply,"Century Ply Laminates are a premium laminate designed to elevate your interiors with its exquisite finish. This laminate boasts an impressive 0.8 mm thickness, making it incredibly durable and resistant to cracking. Its uniform thickness ensures a smooth and seamless surface, while its stain and steam resistance.",https://www.centuryply.com/centurylaminates/productImage/3755.jpg,Wooden Material,Laminate,CRANVILLE ELM 3755,LMNTCMBCRELM3755,,1910.13,,TRUE,PERCENT,15,InStock,,Sheet,1295,,,,Thickness,DROP_DOWN,1mm,,Finish,DROP_DOWN,Combinations,,DROP_DOWN,
Product,Century Ply Look Book Laminate Bertie Elm 3757,Century Ply,"Century Ply Laminates are a premium laminate designed to elevate your interiors with its exquisite finish. This laminate boasts an impressive 0.8 mm thickness, making it incredibly durable and resistant to cracking. Its uniform thickness ensures a smooth and seamless surface, while its stain and steam resistance.",https://www.centuryply.com/centurylaminates/productImage/3757.jpg,Wooden Material,Laminate,BERTIE ELM 3757,LMNTCMBBEELM3757,,1910.13,,TRUE,PERCENT,15,InStock,,Sheet,1295,,,,Thickness,DROP_DOWN,1mm,,Finish,DROP_DOWN,Combinations,,DROP_DOWN,
Product,Century Ply Look Book Laminate Malaga Olive 3789,Century Ply,"Century Ply Laminates are a premium laminate designed to elevate your interiors with its exquisite finish. This laminate boasts an impressive 0.8 mm thickness, making it incredibly durable and resistant to cracking. Its uniform thickness ensures a smooth and seamless surface, while its stain and steam resistance.",https://www.centuryply.com/centurylaminates/productImage/3789.jpg,Wooden Material,Laminate,MALAGA OLIVE 3789,LMNTCMBMAOVE3789,,1910.13,,TRUE,PERCENT,15,InStock,,Sheet,1295,,,,Thickness,DROP_DOWN,1mm,,Finish,DROP_DOWN,Combinations,,DROP_DOWN,
Product,Century Ply Look Book Laminate Sevilla Olive 3788,Century Ply,"Century Ply Laminates are a premium laminate designed to elevate your interiors with its exquisite finish. This laminate boasts an impressive 0.8 mm thickness, making it incredibly durable and resistant to cracking. Its uniform thickness ensures a smooth and seamless surface, while its stain and steam resistance.",https://www.centuryply.com/centurylaminates/productImage/3788.jpg,Wooden Material,Laminate,SEVILLA OLIVE 3788,LMNTCMBSEOVE3788,,1910.13,,TRUE,PERCENT,15,InStock,,Sheet,1295,,,,Thickness,DROP_DOWN,1mm,,Finish,DROP_DOWN,Combinations,,DROP_DOWN,
Product,Century Ply Look Book Laminate Encanto Brownish Oak 4392,Century Ply,"Century Ply Laminates are a premium laminate designed to elevate your interiors with its exquisite finish. This laminate boasts an impressive 0.8 mm thickness, making it incredibly durable and resistant to cracking. Its uniform thickness ensures a smooth and seamless surface, while its stain and steam resistance.",https://www.centuryply.com/centurylaminates/productImage/4392.jpg,Wooden Material,Laminate,ENCANTO BROWNISH OAK 4392,LMNTCMBENBAK4392,,1910.13,,TRUE,PERCENT,15,InStock,,Sheet,1295,,,,Thickness,DROP_DOWN,1mm,,Finish,DROP_DOWN,Combinations,,DROP_DOWN,
Product,Century Ply Look Book Laminate Encanto Creamish Oak 4393,Century Ply,"Century Ply Laminates are a premium laminate designed to elevate your interiors with its exquisite finish. This laminate boasts an impressive 0.8 mm thickness, making it incredibly durable and resistant to cracking. Its uniform thickness ensures a smooth and seamless surface, while its stain and steam resistance.",https://www.centuryply.com/centurylaminates/productImage/4393.jpg,Wooden Material,Laminate,ENCANTO CREAMISH OAK 4393,LMNTCMBENCAK4393,,1910.13,,TRUE,PERCENT,15,InStock,,Sheet,1295,,,,Thickness,DROP_DOWN,1mm,,Finish,DROP_DOWN,Combinations,,DROP_DOWN,
Product,Century Ply Look Book Laminate Granada Olive 4789,Century Ply,"Century Ply Laminates are a premium laminate designed to elevate your interiors with its exquisite finish. This laminate boasts an impressive 0.8 mm thickness, making it incredibly durable and resistant to cracking. Its uniform thickness ensures a smooth and seamless surface, while its stain and steam resistance.",https://www.centuryply.com/centurylaminates/productImage/4789.jpg,Wooden Material,Laminate,GRANADA OLIVE 4789,LMNTCMBGROVE4789,,1910.13,,TRUE,PERCENT,15,InStock,,Sheet,1295,,,,Thickness,DROP_DOWN,1mm,,Finish,DROP_DOWN,Combinations,,DROP_DOWN,
Product,Century Ply Look Book Laminate Eastem Oak 3663,Century Ply,"Century Ply Laminates are a premium laminate designed to elevate your interiors with its exquisite finish. This laminate boasts an impressive 0.8 mm thickness, making it incredibly durable and resistant to cracking. Its uniform thickness ensures a smooth and seamless surface, while its stain and steam resistance.",https://www.centuryply.com/centurylaminates/productImage/new-co-3663-su.jpg,Wooden Material,Laminate,EASTEM OAK 3663,LMNTCMBEAOAK3663,,1910.13,,TRUE,PERCENT,15,InStock,,Sheet,1295,,,,Thickness,DROP_DOWN,1mm,,Finish,DROP_DOWN,Combinations,,DROP_DOWN,
Product,Century Ply Look Book Laminate Horsetail Pine 4538,Century Ply,"Century Ply Laminates are a premium laminate designed to elevate your interiors with its exquisite finish. This laminate boasts an impressive 0.8 mm thickness, making it incredibly durable and resistant to cracking. Its uniform thickness ensures a smooth and seamless surface, while its stain and steam resistance.",https://www.centuryply.com/centurylaminates/productImage/4538.jpg,Wooden Material,Laminate,HORSETAIL PINE 4538,LMNTCMBHOPNE4538,,1910.13,,TRUE,PERCENT,15,InStock,,Sheet,1295,,,,Thickness,DROP_DOWN,1mm,,Finish,DROP_DOWN,Combinations,,DROP_DOWN,
Product,Century Ply Look Book Laminate Massons Pine 4537,Century Ply,"Century Ply Laminates are a premium laminate designed to elevate your interiors with its exquisite finish. This laminate boasts an impressive 0.8 mm thickness, making it incredibly durable and resistant to cracking. Its uniform thickness ensures a smooth and seamless surface, while its stain and steam resistance.",https://www.centuryply.com/centurylaminates/productImage/new-co-4537-su.jpg,Wooden Material,Laminate,MASSONS PINE 4537,LMNTCMBMAPNE4537,,1910.13,,TRUE,PERCENT,15,InStock,,Sheet,1295,,,,Thickness,DROP_DOWN,1mm,,Finish,DROP_DOWN,Combinations,,DROP_DOWN,
Product,Century Ply Look Book Laminate Tokyo Wenge 4953,Century Ply,"Century Ply Laminates are a premium laminate designed to elevate your interiors with its exquisite finish. This laminate boasts an impressive 0.8 mm thickness, making it incredibly durable and resistant to cracking. Its uniform thickness ensures a smooth and seamless surface, while its stain and steam resistance.",https://www.centuryply.com/centurylaminates/productImage/new-co-4953-sf.jpg,Wooden Material,Laminate,TOKYO WENGE 4953,LMNTCMBTOWGE4953,,1910.13,,TRUE,PERCENT,15,InStock,,Sheet,1295,,,,Thickness,DROP_DOWN,1mm,,Finish,DROP_DOWN,Combinations,,DROP_DOWN,
Product,Century Ply Look Book Laminate Silver Wenge 4952,Century Ply,"Century Ply Laminates are a premium laminate designed to elevate your interiors with its exquisite finish. This laminate boasts an impressive 0.8 mm thickness, making it incredibly durable and resistant to cracking. Its uniform thickness ensures a smooth and seamless surface, while its stain and steam resistance.",https://www.centuryply.com/centurylaminates/productImage/4952.jpg,Wooden Material,Laminate,SILVER WENGE 4952,LMNTCMBSIWGE4952,,1910.13,,TRUE,PERCENT,15,InStock,,Sheet,1295,,,,Thickness,DROP_DOWN,1mm,,Finish,DROP_DOWN,Combinations,,DROP_DOWN,
Product,Century Ply Look Book Laminate Chestnut Oak 3665,Century Ply,"Century Ply Laminates are a premium laminate designed to elevate your interiors with its exquisite finish. This laminate boasts an impressive 0.8 mm thickness, making it incredibly durable and resistant to cracking. Its uniform thickness ensures a smooth and seamless surface, while its stain and steam resistance.",https://www.centuryply.com/centurylaminates/productImage/new-co-3665-su.jpg,Wooden Material,Laminate,CHESTNUT OAK 3665,LMNTCMBCHOAK3665,,1910.13,,TRUE,PERCENT,15,InStock,,Sheet,1295,,,,Thickness,DROP_DOWN,1mm,,Finish,DROP_DOWN,Combinations,,DROP_DOWN,
Product,Century Ply Look Book Laminate Nambia Oak 4664,Century Ply,"Century Ply Laminates are a premium laminate designed to elevate your interiors with its exquisite finish. This laminate boasts an impressive 0.8 mm thickness, making it incredibly durable and resistant to cracking. Its uniform thickness ensures a smooth and seamless surface, while its stain and steam resistance.",https://www.centuryply.com/centurylaminates/productImage/4664.jpg,Wooden Material,Laminate,NAMBIA OAK 4664,LMNTCMBNAOAK4664,,1910.13,,TRUE,PERCENT,15,InStock,,Sheet,1295,,,,Thickness,DROP_DOWN,1mm,,Finish,DROP_DOWN,Combinations,,DROP_DOWN,
Product,Century Ply Look Book Laminate Baltic Ash 608,Century Ply,"Century Ply Laminates are a premium laminate designed to elevate your interiors with its exquisite finish. This laminate boasts an impressive 0.8 mm thickness, making it incredibly durable and resistant to cracking. Its uniform thickness ensures a smooth and seamless surface, while its stain and steam resistance.",https://www.centuryply.com/centurylaminates/productImage/new-co-608-su.jpg,Wooden Material,Laminate,BALTIC ASH 608,LMNTCMBBAASH608,,1910.13,,TRUE,PERCENT,15,InStock,,Sheet,1295,,,,Thickness,DROP_DOWN,1mm,,Finish,DROP_DOWN,Combinations,,DROP_DOWN,
Product,Century Ply Look Book Laminate Bornholm Ash 607,Century Ply,"Century Ply Laminates are a premium laminate designed to elevate your interiors with its exquisite finish. This laminate boasts an impressive 0.8 mm thickness, making it incredibly durable and resistant to cracking. Its uniform thickness ensures a smooth and seamless surface, while its stain and steam resistance.",https://www.centuryply.com/centurylaminates/productImage/607.jpg,Wooden Material,Laminate,BORNHOLM ASH 607,LMNTCMBBOASH607,,1910.13,,TRUE,PERCENT,15,InStock,,Sheet,1295,,,,Thickness,DROP_DOWN,1mm,,Finish,DROP_DOWN,Combinations,,DROP_DOWN,
Product,Century Ply Look Book Laminate Nexo Ash 606,Century Ply,"Century Ply Laminates are a premium laminate designed to elevate your interiors with its exquisite finish. This laminate boasts an impressive 0.8 mm thickness, making it incredibly durable and resistant to cracking. Its uniform thickness ensures a smooth and seamless surface, while its stain and steam resistance.",https://www.centuryply.com/centurylaminates/productImage/606.jpg,Wooden Material,Laminate,NEXO ASH 606,LMNTCMBNEASH606,,1910.13,,TRUE,PERCENT,15,InStock,,Sheet,1295,,,,Thickness,DROP_DOWN,1mm,,Finish,DROP_DOWN,Combinations,,DROP_DOWN,
Product,Century Ply Look Book Laminate Betula Wood 729,Century Ply,"Century Ply Laminates are a premium laminate designed to elevate your interiors with its exquisite finish. This laminate boasts an impressive 0.8 mm thickness, making it incredibly durable and resistant to cracking. Its uniform thickness ensures a smooth and seamless surface, while its stain and steam resistance.",https://www.centuryply.com/centurylaminates/productImage/729.jpg,Wooden Material,Laminate,BETULA WOOD 729,LMNTCMBBEWOD729,,1910.13,,TRUE,PERCENT,15,InStock,,Sheet,1295,,,,Thickness,DROP_DOWN,1mm,,Finish,DROP_DOWN,Combinations,,DROP_DOWN,
Product,Century Ply Look Book Laminate Ostrya Wood 727,Century Ply,"Century Ply Laminates are a premium laminate designed to elevate your interiors with its exquisite finish. This laminate boasts an impressive 0.8 mm thickness, making it incredibly durable and resistant to cracking. Its uniform thickness ensures a smooth and seamless surface, while its stain and steam resistance.",https://www.centuryply.com/centurylaminates/productImage/727.jpg,Wooden Material,Laminate,OSTRYA WOOD 727,LMNTCMBOSWOD727,,1910.13,,TRUE,PERCENT,15,InStock,,Sheet,1295,,,,Thickness,DROP_DOWN,1mm,,Finish,DROP_DOWN,Combinations,,DROP_DOWN,
Product,Century Ply Look Book Laminate Nageia Wood 728,Century Ply,"Century Ply Laminates are a premium laminate designed to elevate your interiors with its exquisite finish. This laminate boasts an impressive 0.8 mm thickness, making it incredibly durable and resistant to cracking. Its uniform thickness ensures a smooth and seamless surface, while its stain and steam resistance.",https://www.centuryply.com/centurylaminates/productImage/728.jpg,Wooden Material,Laminate,NAGEIA WOOD 728,LMNTCMBNAWOD728,,1910.13,,TRUE,PERCENT,15,InStock,,Sheet,1295,,,,Thickness,DROP_DOWN,1mm,,Finish,DROP_DOWN,Combinations,,DROP_DOWN,
Product,Century Ply Look Book Laminate Kernel Walnut 4526,Century Ply,"Century Ply Laminates are a premium laminate designed to elevate your interiors with its exquisite finish. This laminate boasts an impressive 0.8 mm thickness, making it incredibly durable and resistant to cracking. Its uniform thickness ensures a smooth and seamless surface, while its stain and steam resistance.",https://www.centuryply.com/centurylaminates/productImage/4526.jpg,Wooden Material,Laminate,KERNEL WALNUT 4526,LMNTCMBKEWUT4526,,1910.13,,TRUE,PERCENT,15,InStock,,Sheet,1295,,,,Thickness,DROP_DOWN,1mm,,Finish,DROP_DOWN,Combinations,,DROP_DOWN,
Product,Century Ply Look Book Laminate Derby Walnut 4524,Century Ply,"Century Ply Laminates are a premium laminate designed to elevate your interiors with its exquisite finish. This laminate boasts an impressive 0.8 mm thickness, making it incredibly durable and resistant to cracking. Its uniform thickness ensures a smooth and seamless surface, while its stain and steam resistance.",https://www.centuryply.com/centurylaminates/productImage/4524.jpg,Wooden Material,Laminate,DERBY WALNUT 4524,LMNTCMBDEWUT4524,,1910.13,,TRUE,PERCENT,15,InStock,,Sheet,1295,,,,Thickness,DROP_DOWN,1mm,,Finish,DROP_DOWN,Combinations,,DROP_DOWN,
Product,Century Ply Look Book Laminate Dover Walnut 4525,Century Ply,"Century Ply Laminates are a premium laminate designed to elevate your interiors with its exquisite finish. This laminate boasts an impressive 0.8 mm thickness, making it incredibly durable and resistant to cracking. Its uniform thickness ensures a smooth and seamless surface, while its stain and steam resistance.",https://www.centuryply.com/centurylaminates/productImage/4525.jpg,Wooden Material,Laminate,DOVER WALNUT 4525,LMNTCMBDOWUT4525,,1910.13,,TRUE,PERCENT,15,InStock,,Sheet,1295,,,,Thickness,DROP_DOWN,1mm,,Finish,DROP_DOWN,Combinations,,DROP_DOWN,
Product,Century Ply Look Book Laminate Quite Wood 686,Century Ply,"Century Ply Laminates are a premium laminate designed to elevate your interiors with its exquisite finish. This laminate boasts an impressive 0.8 mm thickness, making it incredibly durable and resistant to cracking. Its uniform thickness ensures a smooth and seamless surface, while its stain and steam resistance.",https://www.centuryply.com/centurylaminates/productImage/686.jpg,Wooden Material,Laminate,QUITE WOOD 686,LMNTCMBQUWOD686,,1910.13,,TRUE,PERCENT,15,InStock,,Sheet,1295,,,,Thickness,DROP_DOWN,1mm,,Finish,DROP_DOWN,Combinations,,DROP_DOWN,
Product,Century Ply Look Book Laminate Pretty Wood 688,Century Ply,"Century Ply Laminates are a premium laminate designed to elevate your interiors with its exquisite finish. This laminate boasts an impressive 0.8 mm thickness, making it incredibly durable and resistant to cracking. Its uniform thickness ensures a smooth and seamless surface, while its stain and steam resistance.",https://www.centuryply.com/centurylaminates/productImage/688.jpg,Wooden Material,Laminate,PRETTY WOOD 688,LMNTCMBPRWOD688,,1910.13,,TRUE,PERCENT,15,InStock,,Sheet,1295,,,,Thickness,DROP_DOWN,1mm,,Finish,DROP_DOWN,Combinations,,DROP_DOWN,
Product,Century Ply Look Book Laminate Fairy Wood 687,Century Ply,"Century Ply Laminates are a premium laminate designed to elevate your interiors with its exquisite finish. This laminate boasts an impressive 0.8 mm thickness, making it incredibly durable and resistant to cracking. Its uniform thickness ensures a smooth and seamless surface, while its stain and steam resistance.",https://www.centuryply.com/centurylaminates/productImage/687.jpg,Wooden Material,Laminate,FAIRY WOOD 687,LMNTCMBFAWOD687,,1910.13,,TRUE,PERCENT,15,InStock,,Sheet,1295,,,,Thickness,DROP_DOWN,1mm,,Finish,DROP_DOWN,Combinations,,DROP_DOWN,
Product,Century Ply Look Book Laminate Marina Oak 4657,Century Ply,"Century Ply Laminates are a premium laminate designed to elevate your interiors with its exquisite finish. This laminate boasts an impressive 0.8 mm thickness, making it incredibly durable and resistant to cracking. Its uniform thickness ensures a smooth and seamless surface, while its stain and steam resistance.",https://www.centuryply.com/centurylaminates/productImage/4657.jpg,Wooden Material,Laminate,MARINA OAK 4657,LMNTCMBMAOAK4657,,1910.13,,TRUE,PERCENT,15,InStock,,Sheet,1295,,,,Thickness,DROP_DOWN,1mm,,Finish,DROP_DOWN,Combinations,,DROP_DOWN,
Product,Century Ply Look Book Laminate Bahia Oak 4658,Century Ply,"Century Ply Laminates are a premium laminate designed to elevate your interiors with its exquisite finish. This laminate boasts an impressive 0.8 mm thickness, making it incredibly durable and resistant to cracking. Its uniform thickness ensures a smooth and seamless surface, while its stain and steam resistance.",https://www.centuryply.com/centurylaminates/productImage/4658.jpg,Wooden Material,Laminate,BAHIA OAK 4658,LMNTCMBBAOAK4658,,1910.13,,TRUE,PERCENT,15,InStock,,Sheet,1295,,,,Thickness,DROP_DOWN,1mm,,Finish,DROP_DOWN,Combinations,,DROP_DOWN,
