fieldType,Product Name,Brand,description,productImageUrl,Category,Sub Category,Prod Code,sku,ribbon,price,surcharge,visible,discountMode,discountValue,inventory,weight,Unit Value,Sale Price,Base Price,GST Rate,GST Amount,Filter 1,Filter 1 Type,Filter 1 Value,additionalInfoTitle1,Filter 2,Filter 2 Type,Filter 2 Value,Filter 3,Filter 3 Type,Filter 3 Value
Product,Century Ply Look Book Laminate Arctic Blue 3245 Lu,Century Ply,"Century Ply Laminates are a premium laminate designed to elevate your interiors with its exquisite finish. This laminate boasts an impressive 0.8 mm thickness, making it incredibly durable and resistant to cracking. Its uniform thickness ensures a smooth and seamless surface, while its stain and steam resistance.",https://www.centuryply.com/centurylaminates/designlibrary/image/3245-LU-New.jpg,Wooden Material,Laminate,ARCTIC BLUE 3245 LU,LMNTACRARBUE3245LU,,2795.13,,TRUE,PERCENT,15,InStock,,Sheet,1895,,,,Thickness,DROP_DOWN,1.25mm,,Finish,DROP_DOWN,Acrylo,,DROP_DOWN,
Product,Century Ply Look Book Laminate Arctic Blue 3245 Um,Century Ply,"Century Ply Laminates are a premium laminate designed to elevate your interiors with its exquisite finish. This laminate boasts an impressive 0.8 mm thickness, making it incredibly durable and resistant to cracking. Its uniform thickness ensures a smooth and seamless surface, while its stain and steam resistance.",https://www.centuryply.com/centurylaminates/designlibrary/image/content_data/3245-UM-New.jpg,Wooden Material,Laminate,ARCTIC BLUE 3245 UM,LMNTACRARBUE3245UM,,5782,,TRUE,PERCENT,15,InStock,,Sheet,3920,,,,Thickness,DROP_DOWN,1.25mm,,Finish,DROP_DOWN,Acrylo,,DROP_DOWN,
Product,Century Ply Look Book Laminate Seafoam Green 3282 Um,Century Ply,"Century Ply Laminates are a premium laminate designed to elevate your interiors with its exquisite finish. This laminate boasts an impressive 0.8 mm thickness, making it incredibly durable and resistant to cracking. Its uniform thickness ensures a smooth and seamless surface, while its stain and steam resistance.",https://www.centuryply.com/centurylaminates/designlibrary/image/content_data/3282-UM-New.jpg,Wooden Material,Laminate,SEAFOAM GREEN 3282 UM,LMNTACRSEGEN3282UM,,5782,,TRUE,PERCENT,15,InStock,,Sheet,3920,,,,Thickness,DROP_DOWN,1.25mm,,Finish,DROP_DOWN,Acrylo,,DROP_DOWN,
Product,Century Ply Look Book Laminate Seafoam Green 3282 Lu,Century Ply,"Century Ply Laminates are a premium laminate designed to elevate your interiors with its exquisite finish. This laminate boasts an impressive 0.8 mm thickness, making it incredibly durable and resistant to cracking. Its uniform thickness ensures a smooth and seamless surface, while its stain and steam resistance.",https://www.centuryply.com/centurylaminates/designlibrary/image/content_data/3282-LU-New.jpg,Wooden Material,Laminate,SEAFOAM GREEN 3282 LU,LMNTACRSEGEN3282LU,,2795.13,,TRUE,PERCENT,15,InStock,,Sheet,1895,,,,Thickness,DROP_DOWN,1.25mm,,Finish,DROP_DOWN,Acrylo,,DROP_DOWN,
Product,Century Ply Look Book Laminate Teal 3272 Lu,Century Ply,"Century Ply Laminates are a premium laminate designed to elevate your interiors with its exquisite finish. This laminate boasts an impressive 0.8 mm thickness, making it incredibly durable and resistant to cracking. Its uniform thickness ensures a smooth and seamless surface, while its stain and steam resistance.",https://www.centuryply.com/centurylaminates/designlibrary/image/content_data/3272-LU-New.jpg,Wooden Material,Laminate,TEAL 3272 LU,LMNTACRTETAL3272LU,,2795.13,,TRUE,PERCENT,15,InStock,,Sheet,1895,,,,Thickness,DROP_DOWN,1.25mm,,Finish,DROP_DOWN,Acrylo,,DROP_DOWN,
Product,Century Ply Look Book Laminate Teal 3272 Um,Century Ply,"Century Ply Laminates are a premium laminate designed to elevate your interiors with its exquisite finish. This laminate boasts an impressive 0.8 mm thickness, making it incredibly durable and resistant to cracking. Its uniform thickness ensures a smooth and seamless surface, while its stain and steam resistance.",https://www.centuryply.com/centurylaminates/designlibrary/image/content_data/3272-UM-New.jpg,Wooden Material,Laminate,TEAL 3272 UM,LMNTACRTETAL3272UM,,5782,,TRUE,PERCENT,15,InStock,,Sheet,3920,,,,Thickness,DROP_DOWN,1.25mm,,Finish,DROP_DOWN,Acrylo,,DROP_DOWN,
Product,Century Ply Look Book Laminate Brazilian Sand 168 Um,Century Ply,"Century Ply Laminates are a premium laminate designed to elevate your interiors with its exquisite finish. This laminate boasts an impressive 0.8 mm thickness, making it incredibly durable and resistant to cracking. Its uniform thickness ensures a smooth and seamless surface, while its stain and steam resistance.",https://www.centuryply.com/centurylaminates/designlibrary/image/content_data/168-UM-New.jpg,Wooden Material,Laminate,BRAZILIAN SAND 168 UM,LMNTACRBRSND168UM,,5782,,TRUE,PERCENT,15,InStock,,Sheet,3920,,,,Thickness,DROP_DOWN,1.25mm,,Finish,DROP_DOWN,Acrylo,,DROP_DOWN,
Product,Century Ply Look Book Laminate Brazilian Sand 168 Lu,Century Ply,"Century Ply Laminates are a premium laminate designed to elevate your interiors with its exquisite finish. This laminate boasts an impressive 0.8 mm thickness, making it incredibly durable and resistant to cracking. Its uniform thickness ensures a smooth and seamless surface, while its stain and steam resistance.",https://www.centuryply.com/centurylaminates/designlibrary/image/content_data/168-LU-New.jpg,Wooden Material,Laminate,BRAZILIAN SAND 168 LU,LMNTACRBRSND168LU,,2795.13,,TRUE,PERCENT,15,InStock,,Sheet,1895,,,,Thickness,DROP_DOWN,1.25mm,,Finish,DROP_DOWN,Acrylo,,DROP_DOWN,
Product,Century Ply Look Book Laminate Giza Triangle 4942 Um,Century Ply,"Century Ply Laminates are a premium laminate designed to elevate your interiors with its exquisite finish. This laminate boasts an impressive 0.8 mm thickness, making it incredibly durable and resistant to cracking. Its uniform thickness ensures a smooth and seamless surface, while its stain and steam resistance.",https://www.centuryply.com/centurylaminates/designlibrary/image/content_data/4942-UM-New.jpg,Wooden Material,Laminate,GIZA TRIANGLE 4942 UM,LMNTACRGITLE4942UM,,5782,,TRUE,PERCENT,15,InStock,,Sheet,3920,,,,Thickness,DROP_DOWN,1.25mm,,Finish,DROP_DOWN,Acrylo,,DROP_DOWN,
Product,Century Ply Look Book Laminate Giza Triangle 4942 Lu,Century Ply,"Century Ply Laminates are a premium laminate designed to elevate your interiors with its exquisite finish. This laminate boasts an impressive 0.8 mm thickness, making it incredibly durable and resistant to cracking. Its uniform thickness ensures a smooth and seamless surface, while its stain and steam resistance.",https://www.centuryply.com/centurylaminates/designlibrary/image/content_data/4942-LU-New.jpg,Wooden Material,Laminate,GIZA TRIANGLE 4942 LU,LMNTACRGITLE4942LU,,2795.13,,TRUE,PERCENT,15,InStock,,Sheet,1895,,,,Thickness,DROP_DOWN,1.25mm,,Finish,DROP_DOWN,Acrylo,,DROP_DOWN,
Product,Century Ply Look Book Laminate Cairo Triangle 4941 Um,Century Ply,"Century Ply Laminates are a premium laminate designed to elevate your interiors with its exquisite finish. This laminate boasts an impressive 0.8 mm thickness, making it incredibly durable and resistant to cracking. Its uniform thickness ensures a smooth and seamless surface, while its stain and steam resistance.",https://www.centuryply.com/centurylaminates/designlibrary/image/content_data/4941-UM-New.jpg,Wooden Material,Laminate,CAIRO TRIANGLE 4941 UM,LMNTACRCATLE4941UM,,5782,,TRUE,PERCENT,15,InStock,,Sheet,3920,,,,Thickness,DROP_DOWN,1.25mm,,Finish,DROP_DOWN,Acrylo,,DROP_DOWN,
Product,Century Ply Look Book Laminate Luxor Triangle 4943 Um,Century Ply,"Century Ply Laminates are a premium laminate designed to elevate your interiors with its exquisite finish. This laminate boasts an impressive 0.8 mm thickness, making it incredibly durable and resistant to cracking. Its uniform thickness ensures a smooth and seamless surface, while its stain and steam resistance.",https://www.centuryply.com/centurylaminates/designlibrary/image/content_data/4943-UM-New.jpg,Wooden Material,Laminate,LUXOR TRIANGLE 4943 UM,LMNTACRLUTLE4943UM,,5782,,TRUE,PERCENT,15,InStock,,Sheet,3920,,,,Thickness,DROP_DOWN,1.25mm,,Finish,DROP_DOWN,Acrylo,,DROP_DOWN,
Product,Century Ply Look Book Laminate Cairo Triangle 4941 Lu,Century Ply,"Century Ply Laminates are a premium laminate designed to elevate your interiors with its exquisite finish. This laminate boasts an impressive 0.8 mm thickness, making it incredibly durable and resistant to cracking. Its uniform thickness ensures a smooth and seamless surface, while its stain and steam resistance.",https://www.centuryply.com/centurylaminates/designlibrary/image/content_data/4941-LU-New.jpg,Wooden Material,Laminate,CAIRO TRIANGLE 4941 LU,LMNTACRCATLE4941LU,,2795.13,,TRUE,PERCENT,15,InStock,,Sheet,1895,,,,Thickness,DROP_DOWN,1.25mm,,Finish,DROP_DOWN,Acrylo,,DROP_DOWN,
Product,Century Ply Look Book Laminate Luxor Triangle 4943 Lu,Century Ply,"Century Ply Laminates are a premium laminate designed to elevate your interiors with its exquisite finish. This laminate boasts an impressive 0.8 mm thickness, making it incredibly durable and resistant to cracking. Its uniform thickness ensures a smooth and seamless surface, while its stain and steam resistance.",https://www.centuryply.com/centurylaminates/designlibrary/image/content_data/4943-LU-New.jpg,Wooden Material,Laminate,LUXOR TRIANGLE 4943 LU,LMNTACRLUTLE4943LU,,2795.13,,TRUE,PERCENT,15,InStock,,Sheet,1895,,,,Thickness,DROP_DOWN,1.25mm,,Finish,DROP_DOWN,Acrylo,,DROP_DOWN,
Product,Century Ply Look Book Laminate Blood Red 194 Lu,Century Ply,"Century Ply Laminates are a premium laminate designed to elevate your interiors with its exquisite finish. This laminate boasts an impressive 0.8 mm thickness, making it incredibly durable and resistant to cracking. Its uniform thickness ensures a smooth and seamless surface, while its stain and steam resistance.",https://www.centuryply.com/centurylaminates/designlibrary/image/194-LU_N.jpg,Wooden Material,Laminate,BLOOD RED 194 LU,LMNTLUCBLRED194LU,,2795.13,,TRUE,PERCENT,15,InStock,,Sheet,1895,,,,Thickness,DROP_DOWN,1mm,,Finish,DROP_DOWN,Lucida,,DROP_DOWN,
Product,Century Ply Look Book Laminate Shorea Mahogany 3961 Lu,Century Ply,"Century Ply Laminates are a premium laminate designed to elevate your interiors with its exquisite finish. This laminate boasts an impressive 0.8 mm thickness, making it incredibly durable and resistant to cracking. Its uniform thickness ensures a smooth and seamless surface, while its stain and steam resistance.",https://www.centuryply.com/centurylaminates/productImage/3961-LU_N.jpg,Wooden Material,Laminate,SHOREA MAHOGANY 3961 LU,LMNTLUCSHMNY3961LU,,2795.13,,TRUE,PERCENT,15,InStock,,Sheet,1895,,,,Thickness,DROP_DOWN,1mm,,Finish,DROP_DOWN,Lucida,,DROP_DOWN,
Product,Century Ply Look Book Laminate Sunrise Glacier 3922 Lu,Century Ply,"Century Ply Laminates are a premium laminate designed to elevate your interiors with its exquisite finish. This laminate boasts an impressive 0.8 mm thickness, making it incredibly durable and resistant to cracking. Its uniform thickness ensures a smooth and seamless surface, while its stain and steam resistance.",https://www.centuryply.com/centurylaminates/productImage/3922-LU_N.jpg,Wooden Material,Laminate,SUNRISE GLACIER 3922 LU,LMNTLUCSUGER3922LU,,2795.13,,TRUE,PERCENT,15,InStock,,Sheet,1895,,,,Thickness,DROP_DOWN,1mm,,Finish,DROP_DOWN,Lucida,,DROP_DOWN,
Product,Century Ply Look Book Laminate Shell Glacier 4913 Lu,Century Ply,"Century Ply Laminates are a premium laminate designed to elevate your interiors with its exquisite finish. This laminate boasts an impressive 0.8 mm thickness, making it incredibly durable and resistant to cracking. Its uniform thickness ensures a smooth and seamless surface, while its stain and steam resistance.",https://www.centuryply.com/centurylaminates/productImage/4913-LU-N.jpg,Wooden Material,Laminate,SHELL GLACIER 4913 LU,LMNTLUCSHGER4913LU,,2795.13,,TRUE,PERCENT,15,InStock,,Sheet,1895,,,,Thickness,DROP_DOWN,1mm,,Finish,DROP_DOWN,Lucida,,DROP_DOWN,
Product,Century Ply Look Book Laminate Snow Glacier 3917 Lu,Century Ply,"Century Ply Laminates are a premium laminate designed to elevate your interiors with its exquisite finish. This laminate boasts an impressive 0.8 mm thickness, making it incredibly durable and resistant to cracking. Its uniform thickness ensures a smooth and seamless surface, while its stain and steam resistance.",https://www.centuryply.com/centurylaminates/productImage/3917-LU_N.jpg,Wooden Material,Laminate,SNOW GLACIER 3917 LU,LMNTLUCSNGER3917LU,,2795.13,,TRUE,PERCENT,15,InStock,,Sheet,1895,,,,Thickness,DROP_DOWN,1mm,,Finish,DROP_DOWN,Lucida,,DROP_DOWN,
Product,Century Ply Look Book Laminate Silver Glacier 3918 Lu,Century Ply,"Century Ply Laminates are a premium laminate designed to elevate your interiors with its exquisite finish. This laminate boasts an impressive 0.8 mm thickness, making it incredibly durable and resistant to cracking. Its uniform thickness ensures a smooth and seamless surface, while its stain and steam resistance.",https://www.centuryply.com/centurylaminates/productImage/3918-LU_N.jpg,Wooden Material,Laminate,SILVER GLACIER 3918 LU,LMNTLUCSIGER3918LU,,2795.13,,TRUE,PERCENT,15,InStock,,Sheet,1895,,,,Thickness,DROP_DOWN,1mm,,Finish,DROP_DOWN,Lucida,,DROP_DOWN,
Product,Century Ply Look Book Laminate Pearl Glacier 4911 Lu,Century Ply,"Century Ply Laminates are a premium laminate designed to elevate your interiors with its exquisite finish. This laminate boasts an impressive 0.8 mm thickness, making it incredibly durable and resistant to cracking. Its uniform thickness ensures a smooth and seamless surface, while its stain and steam resistance.",https://www.centuryply.com/centurylaminates/productImage/4911-LU-N.jpg,Wooden Material,Laminate,PEARL GLACIER 4911 LU,LMNTLUCPEGER4911LU,,2795.13,,TRUE,PERCENT,15,InStock,,Sheet,1895,,,,Thickness,DROP_DOWN,1mm,,Finish,DROP_DOWN,Lucida,,DROP_DOWN,
Product,Century Ply Look Book Laminate Copper Eiche 3965 Lu,Century Ply,"Century Ply Laminates are a premium laminate designed to elevate your interiors with its exquisite finish. This laminate boasts an impressive 0.8 mm thickness, making it incredibly durable and resistant to cracking. Its uniform thickness ensures a smooth and seamless surface, while its stain and steam resistance.",https://www.centuryply.com/centurylaminates/productImage/3965-LU-N.jpg,Wooden Material,Laminate,COPPER EICHE 3965 LU,LMNTLUCCOEHE3965LU,,2795.13,,TRUE,PERCENT,15,InStock,,Sheet,1895,,,,Thickness,DROP_DOWN,1mm,,Finish,DROP_DOWN,Lucida,,DROP_DOWN,
Product,Century Ply Look Book Laminate Golden Glacier 3919 Lu,Century Ply,"Century Ply Laminates are a premium laminate designed to elevate your interiors with its exquisite finish. This laminate boasts an impressive 0.8 mm thickness, making it incredibly durable and resistant to cracking. Its uniform thickness ensures a smooth and seamless surface, while its stain and steam resistance.",https://www.centuryply.com/centurylaminates/productImage/3919-LU_N.jpg,Wooden Material,Laminate,GOLDEN GLACIER 3919 LU,LMNTLUCGOGER3919LU,,2795.13,,TRUE,PERCENT,15,InStock,,Sheet,1895,,,,Thickness,DROP_DOWN,1mm,,Finish,DROP_DOWN,Lucida,,DROP_DOWN,
Product,Century Ply Look Book Laminate Sand Glacier 4912 Lu,Century Ply,"Century Ply Laminates are a premium laminate designed to elevate your interiors with its exquisite finish. This laminate boasts an impressive 0.8 mm thickness, making it incredibly durable and resistant to cracking. Its uniform thickness ensures a smooth and seamless surface, while its stain and steam resistance.",https://www.centuryply.com/centurylaminates/productImage/4912-LU-N.jpg,Wooden Material,Laminate,SAND GLACIER 4912 LU,LMNTLUCSAGER4912LU,,2795.13,,TRUE,PERCENT,15,InStock,,Sheet,1895,,,,Thickness,DROP_DOWN,1mm,,Finish,DROP_DOWN,Lucida,,DROP_DOWN,
Product,Century Ply Look Book Laminate Cream Eiche 3964 Lu,Century Ply,"Century Ply Laminates are a premium laminate designed to elevate your interiors with its exquisite finish. This laminate boasts an impressive 0.8 mm thickness, making it incredibly durable and resistant to cracking. Its uniform thickness ensures a smooth and seamless surface, while its stain and steam resistance.",https://www.centuryply.com/centurylaminates/productImage/3964-LU-N.jpg,Wooden Material,Laminate,CREAM EICHE 3964 LU,LMNTLUCCREHE3964LU,,2795.13,,TRUE,PERCENT,15,InStock,,Sheet,1895,,,,Thickness,DROP_DOWN,1mm,,Finish,DROP_DOWN,Lucida,,DROP_DOWN,
Product,Century Ply Look Book Laminate Esperanto 3921 Lu,Century Ply,"Century Ply Laminates are a premium laminate designed to elevate your interiors with its exquisite finish. This laminate boasts an impressive 0.8 mm thickness, making it incredibly durable and resistant to cracking. Its uniform thickness ensures a smooth and seamless surface, while its stain and steam resistance.",https://www.centuryply.com/centurylaminates/productImage/3921-LU_N.jpg,Wooden Material,Laminate,ESPERANTO 3921 LU,LMNTLUCESETO3921LU,,2795.13,,TRUE,PERCENT,15,InStock,,Sheet,1895,,,,Thickness,DROP_DOWN,1mm,,Finish,DROP_DOWN,Lucida,,DROP_DOWN,
Product,Century Ply Look Book Laminate Lapis Azul 3835 Lu,Century Ply,"Century Ply Laminates are a premium laminate designed to elevate your interiors with its exquisite finish. This laminate boasts an impressive 0.8 mm thickness, making it incredibly durable and resistant to cracking. Its uniform thickness ensures a smooth and seamless surface, while its stain and steam resistance.",https://www.centuryply.com/centurylaminates/productImage/3835-LU_N.jpg,Wooden Material,Laminate,LAPIS AZUL 3835 LU,LMNTLUCLAAUL3835LU,,2795.13,,TRUE,PERCENT,15,InStock,,Sheet,1895,,,,Thickness,DROP_DOWN,1mm,,Finish,DROP_DOWN,Lucida,,DROP_DOWN,
Product,Century Ply Look Book Laminate Grey Eiche 3966 Lu,Century Ply,"Century Ply Laminates are a premium laminate designed to elevate your interiors with its exquisite finish. This laminate boasts an impressive 0.8 mm thickness, making it incredibly durable and resistant to cracking. Its uniform thickness ensures a smooth and seamless surface, while its stain and steam resistance.",https://www.centuryply.com/centurylaminates/productImage/3966-LU-N.jpg,Wooden Material,Laminate,GREY EICHE 3966 LU,LMNTLUCGREHE3966LU,,2795.13,,TRUE,PERCENT,15,InStock,,Sheet,1895,,,,Thickness,DROP_DOWN,1mm,,Finish,DROP_DOWN,Lucida,,DROP_DOWN,
Product,Century Ply Look Book Laminate Shorea Mahogany 3961 Lu,Century Ply,"Century Ply Laminates are a premium laminate designed to elevate your interiors with its exquisite finish. This laminate boasts an impressive 0.8 mm thickness, making it incredibly durable and resistant to cracking. Its uniform thickness ensures a smooth and seamless surface, while its stain and steam resistance.",https://www.centuryply.com/centurylaminates/productImage/3961-LU_N.jpg,Wooden Material,Laminate,SHOREA MAHOGANY 3961 LU,LMNTLUCSHMNY3961LU,,2795.13,,TRUE,PERCENT,15,InStock,,Sheet,1895,,,,Thickness,DROP_DOWN,1mm,,Finish,DROP_DOWN,Lucida,,DROP_DOWN,
Product,Century Ply Look Book Laminate Mayapis Mahogany 3963 Lu,Century Ply,"Century Ply Laminates are a premium laminate designed to elevate your interiors with its exquisite finish. This laminate boasts an impressive 0.8 mm thickness, making it incredibly durable and resistant to cracking. Its uniform thickness ensures a smooth and seamless surface, while its stain and steam resistance.",https://www.centuryply.com/centurylaminates/productImage/3963-LU_N.jpg,Wooden Material,Laminate,MAYAPIS MAHOGANY 3963 LU,LMNTLUCMAMNY3963LU,,2795.13,,TRUE,PERCENT,15,InStock,,Sheet,1895,,,,Thickness,DROP_DOWN,1mm,,Finish,DROP_DOWN,Lucida,,DROP_DOWN,
Product,Century Ply Look Book Laminate Almon Mahogany 3962 Lu,Century Ply,"Century Ply Laminates are a premium laminate designed to elevate your interiors with its exquisite finish. This laminate boasts an impressive 0.8 mm thickness, making it incredibly durable and resistant to cracking. Its uniform thickness ensures a smooth and seamless surface, while its stain and steam resistance.",https://www.centuryply.com/centurylaminates/productImage/3962-LU_N.jpg,Wooden Material,Laminate,ALMON MAHOGANY 3962 LU,LMNTLUCALMNY3962LU,,2795.13,,TRUE,PERCENT,15,InStock,,Sheet,1895,,,,Thickness,DROP_DOWN,1mm,,Finish,DROP_DOWN,Lucida,,DROP_DOWN,
Product,Century Ply Look Book Laminate Peach Pink 151 Lu,Century Ply,"Century Ply Laminates are a premium laminate designed to elevate your interiors with its exquisite finish. This laminate boasts an impressive 0.8 mm thickness, making it incredibly durable and resistant to cracking. Its uniform thickness ensures a smooth and seamless surface, while its stain and steam resistance.",https://www.centuryply.com/centurylaminates/productImage/151-LU_N.jpg,Wooden Material,Laminate,PEACH PINK 151 LU,LMNTLUCPEPNK151LU,,2795.13,,TRUE,PERCENT,15,InStock,,Sheet,1895,,,,Thickness,DROP_DOWN,1mm,,Finish,DROP_DOWN,Lucida,,DROP_DOWN,
Product,Century Ply Look Book Laminate Dusk Purple 159 Lu,Century Ply,"Century Ply Laminates are a premium laminate designed to elevate your interiors with its exquisite finish. This laminate boasts an impressive 0.8 mm thickness, making it incredibly durable and resistant to cracking. Its uniform thickness ensures a smooth and seamless surface, while its stain and steam resistance.",https://www.centuryply.com/centurylaminates/productImage/159-LU_N.jpg,Wooden Material,Laminate,DUSK PURPLE 159 LU,LMNTLUCDUPLE159LU,,2795.13,,TRUE,PERCENT,15,InStock,,Sheet,1895,,,,Thickness,DROP_DOWN,1mm,,Finish,DROP_DOWN,Lucida,,DROP_DOWN,
Product,Century Ply Look Book Laminate Hot Pink 90155 Lu,Century Ply,"Century Ply Laminates are a premium laminate designed to elevate your interiors with its exquisite finish. This laminate boasts an impressive 0.8 mm thickness, making it incredibly durable and resistant to cracking. Its uniform thickness ensures a smooth and seamless surface, while its stain and steam resistance.",https://www.centuryply.com/centurylaminates/productImage/90155-LU_N.jpg,Wooden Material,Laminate,HOT PINK 90155 LU,LMNTLUCHOPNK90155LU,,2795.13,,TRUE,PERCENT,15,InStock,,Sheet,1895,,,,Thickness,DROP_DOWN,1mm,,Finish,DROP_DOWN,Lucida,,DROP_DOWN,
Product,Century Ply Look Book Laminate Blood Red 194 Lu,Century Ply,"Century Ply Laminates are a premium laminate designed to elevate your interiors with its exquisite finish. This laminate boasts an impressive 0.8 mm thickness, making it incredibly durable and resistant to cracking. Its uniform thickness ensures a smooth and seamless surface, while its stain and steam resistance.",https://www.centuryply.com/centurylaminates/productImage/194-LU_N.jpg,Wooden Material,Laminate,BLOOD RED 194 LU,LMNTLUCBLRED194LU,,2795.13,,TRUE,PERCENT,15,InStock,,Sheet,1895,,,,Thickness,DROP_DOWN,1mm,,Finish,DROP_DOWN,Lucida,,DROP_DOWN,
Product,Century Ply Look Book Laminate Vintage Burgundy 181 Lu,Century Ply,"Century Ply Laminates are a premium laminate designed to elevate your interiors with its exquisite finish. This laminate boasts an impressive 0.8 mm thickness, making it incredibly durable and resistant to cracking. Its uniform thickness ensures a smooth and seamless surface, while its stain and steam resistance.",https://www.centuryply.com/centurylaminates/productImage/181-LU_N.jpg,Wooden Material,Laminate,VINTAGE BURGUNDY 181 LU,LMNTLUCVIBDY181LU,,2795.13,,TRUE,PERCENT,15,InStock,,Sheet,1895,,,,Thickness,DROP_DOWN,1mm,,Finish,DROP_DOWN,Lucida,,DROP_DOWN,
Product,Century Ply Look Book Laminate Navy Blue 249 Lu,Century Ply,"Century Ply Laminates are a premium laminate designed to elevate your interiors with its exquisite finish. This laminate boasts an impressive 0.8 mm thickness, making it incredibly durable and resistant to cracking. Its uniform thickness ensures a smooth and seamless surface, while its stain and steam resistance.",https://www.centuryply.com/centurylaminates/productImage/249-LU_N.jpg,Wooden Material,Laminate,NAVY BLUE 249 LU,LMNTLUCNABUE249LU,,2795.13,,TRUE,PERCENT,15,InStock,,Sheet,1895,,,,Thickness,DROP_DOWN,1mm,,Finish,DROP_DOWN,Lucida,,DROP_DOWN,
Product,Century Ply Look Book Laminate Satin Blue 241 Lu,Century Ply,"Century Ply Laminates are a premium laminate designed to elevate your interiors with its exquisite finish. This laminate boasts an impressive 0.8 mm thickness, making it incredibly durable and resistant to cracking. Its uniform thickness ensures a smooth and seamless surface, while its stain and steam resistance.",https://www.centuryply.com/centurylaminates/productImage/241-LU_N.jpg,Wooden Material,Laminate,SATIN BLUE 241 LU,LMNTLUCSABUE241LU,,2795.13,,TRUE,PERCENT,15,InStock,,Sheet,1895,,,,Thickness,DROP_DOWN,1mm,,Finish,DROP_DOWN,Lucida,,DROP_DOWN,
Product,Century Ply Look Book Laminate Dawn Blue 259 Lu,Century Ply,"Century Ply Laminates are a premium laminate designed to elevate your interiors with its exquisite finish. This laminate boasts an impressive 0.8 mm thickness, making it incredibly durable and resistant to cracking. Its uniform thickness ensures a smooth and seamless surface, while its stain and steam resistance.",https://www.centuryply.com/centurylaminates/productImage/259-LU_N.jpg,Wooden Material,Laminate,DAWN BLUE 259 LU,LMNTLUCDABUE259LU,,2795.13,,TRUE,PERCENT,15,InStock,,Sheet,1895,,,,Thickness,DROP_DOWN,1mm,,Finish,DROP_DOWN,Lucida,,DROP_DOWN,
